{
  "type": "run-completed",
  "id": "550e8400-e29b-41d4-a716-446655440022",
  "device_id": "device-abc-123",
  "timestamp": "2026-03-22T12:10:00Z",
  "payload": {
    "run_id": "c3d4e5f6-a7b8-9012-cdef-123456789012",
    "prd_id": "b2c3d4e5-f6a7-8901-bcde-f12345678901",
    "status": "completed",
    "result": "All acceptance criteria met, 3 files changed",
    "finished_at": "2026-03-22T12:10:00Z"
  }
}
